ASIN,Date_first_available,Discounted_price,Listing_price,Name,Number_of_answered_questions,Number_of_reviews,Product_Rank,Rating
B09FXJN548,"September 12, 2021","$1,856.99","$1,999.99","MSI GE76 Raider Gaming Laptop Intel Core i7-11800H, GeForce RTX 3060, 17.3"" FHD 144HZ, 32GB RAM2TB NVMe SSD, Wi-Fi6, Windows 10",44 answered questions,72 ratings,"   #5,362 in Computers & Accessories ( See Top 100 in Computers & Accessories )      #620 in  Traditional Laptop Computers     ",4.5 out of 5 stars
B09MY5MYC5,"December 3, 2021",No discount,$165.00,"Acer Chromebook 311 11.6 in HD(1366x768) IPS Business Laptop, Intel Celeron N4020 Dual-core up to 1.10GHz, 4GB LPDDR RAM, 32GB eMMC, Chrome OS, Pure Silver, EAT Wireless Mouse",,2 ratings,"   #78,222 in Electronics ( See Top 100 in Electronics )      #7,913 in  Computers & Tablets     ",5.0 out of 5 stars
B08BMLZKL2,"June 22, 2020",No discount,$580.00,"2020 HP 15.6"" Touchscreen Laptop Computer/ 10th Gen Intel Quard-Core i5 1035G1 up to 3.6GHz/ 12GB DDR4 RAM/ 256GB PCIe SSD/ 802.11ac WiFi/ Bluetooth 4.2/ USB 3.1 Type-C/ HDMI/ Silver/ Windows 10 Home",34 answered questions,518 ratings,"   #4,727 in Computers & Accessories ( See Top 100 in Computers & Accessories )      #545 in  Traditional Laptop Computers     ",4.6 out of 5 stars
B09KBNWD9Y,"October 26, 2021",No discount,$155.00,"Lenovo Chromebook 3 11.6"" HD (1366 x 768) Chromebook Business Laptop PC, AMD A6-9220C up to 1.8 GHz, 4GB DDR4, 32GB eMMC, Webcam, Bluetooth, Chrome OS, EAT 64GB SD Card, Onyx Black",,2 ratings,"   #6,995 in Computers & Accessories ( See Top 100 in Computers & Accessories )      #848 in  Traditional Laptop Computers     ",5.0 out of 5 stars
B09KHHFVRT,"October 27, 2021",No discount,$498.00,"Newest Dell Inspiron 3510 Laptop, 15.6"" HD Display, Intel Celeron N4020 Processor, Webcam, WiFi, HDMI, Bluetooth, Black (16GB RAM | 256GB PCIe SSD)",56 answered questions,514 ratings,"   #8,596 in Computers & Accessories ( See Top 100 in Computers & Accessories )      #1,110 in  Traditional Laptop Computers     ",4.5 out of 5 stars
B08YZ52KK1,"April 11, 2021",No discount,"$2,350.34","Acer Nitro 5 AN515-45-R9QH Gaming Laptop, AMD Ryzen 9 5900HX (8-Core) | NVIDIA GeForce RTX 3080 Laptop GPU | 15.6"" QHD 165Hz 3ms IPS Display | 32GB DDR4 | 1TB NVMe SSD | WiFi 6 | RGB Backlit Keyboard",,5 ratings,"   #12,107 in Computers & Accessories ( See Top 100 in Computers & Accessories )      #1,757 in  Traditional Laptop Computers     ",4.7 out of 5 stars
B07T159Q9W,"June 12, 2019",No discount,$67.53,Dell Chromebook 11 CB1C13 11.6inch Laptop Intel Celeron 2955U 1.40GHz 2GB 16GB SSD (Renewed),70 answered questions,"1,407 ratings",   #827 in Computers & Accessories ( See Top 100 in Computers & Accessories )      #78 in  Traditional Laptop Computers     ,4.1 out of 5 stars
B07Q36QYGW,"March 28, 2019",No discount,$166.00,"Lenovo Chromebook S330 14in Laptop Computer, Mediatek MT8173C up to 1.7 Ghz, 4GB RAM, 32GB eMMC SSD, Bluetooth, HDMI, USB-C, SD Card Reader, Chrome OS, Black (Renewed)",58 answered questions,510 ratings,"   #9,345 in Computers & Accessories ( See Top 100 in Computers & Accessories )      #1,228 in  Traditional Laptop Computers     ",4.2 out of 5 stars
B08CDTP2Q1,"July 6, 2020",$501.99,$699.00,"HP 2020 Newest Pavilion X360 2-in-1 Convertible 14"" HD Touch-Screen Laptop, 10th Gen Intel Core i3-1005G1, 8GB Ram, 128GB Ssd, Wifi, Webcam, Win 10 S",26 answered questions,631 ratings,"   #6,078 in Computers & Accessories ( See Top 100 in Computers & Accessories )      #713 in  Traditional Laptop Computers     ",4.5 out of 5 stars
B09NCLC2FX,"December 10, 2021",No discount,"$1,129.00","Newest HP 15t Business Laptop, 15.6’’ Full HD Touchscreen, Intel Core i7-1165G7 Processor, 32GB RAM, 1TB SSD, Backlit Keyboard, Fingerprint Reader, Wi-Fi 6, Webcam, HDMI, Windows 11 Pro, Silver",23 answered questions,61 ratings,"   #12,015 in Computers & Accessories ( See Top 100 in Computers & Accessories )      #1,733 in  Traditional Laptop Computers     ",4.6 out of 5 stars
B09976MPXV,"July 14, 2021",No discount,"$2,799.99","Razer Blade 17 Gaming Laptop: NVIDIA GeForce RTX 3070 - 11th Gen Intel 8-Core i7 CPU - 17.3"" QHD 240Hz - 16GB RAM - 1TB SSD - Chroma RGB - Thunderbolt 3 - SD Card Reader",10 answered questions,20 ratings,"   #19,236 in Computers & Accessories ( See Top 100 in Computers & Accessories )      #2,974 in  Traditional Laptop Computers     ",4.2 out of 5 stars
B09FYLQ24P,"September 10, 2021",No discount,$839.00,"Lenovo ThinkPad C13 Yoga Chromebook, AMD Ryzen 5 3500C, 8GB DDR4 RAM, 256GB SSD Storage, AMD Radeon Graphics, 13.3"" FHD (1920 x 1080) Touch Display, Chrome OS, 20UX001RUS, Abyss Blue",,,"   #100,673 in Computers & Accessories ( See Top 100 in Computers & Accessories )      #20,868 in  Traditional Laptop Computers     ",
B096T4GBC2,"June 7, 2021",No discount,$849.00,"HP Pavilion Laptop (2021 Latest Model), 17.3"" HD+ Narrow Bezel Touchscreen, AMD Ryzen 5 5500U Processor (Beats i7-1185G7), 32GB RAM, 1TB SSD, Long Battery Life, Win 10",9 answered questions,37 ratings,"   #11,348 in Computers & Accessories ( See Top 100 in Computers & Accessories )      #1,578 in  Traditional Laptop Computers     ",4.2 out of 5 stars
B09XGDM43B,"April 8, 2022",No discount,$479.00,"Newest HP Notebook Laptop, 15.6"" HD Display, Intel Celeron N4120 Processor, 16GB DDR4 RAM, 1TB SSD, Media Card Reader, USB Type-C, Wi-Fi, Bluetooth, Windows 11 Home, Silver",20 answered questions,97 ratings,"   #3,443 in Computers & Accessories ( See Top 100 in Computers & Accessories )      #364 in  Traditional Laptop Computers     ",4.7 out of 5 stars
B09TQ4CTFG,"March 1, 2022",No discount,$569.00,"2022 Newest Dell Inspiron 3510 Laptop, 15.6 HD Display, Intel Celeron N4020 Processor, 16GB DDR4 RAM, 1TB PCIe SSD, Webcam, WiFi, HDMI, Bluetooth, Win10 Home, Black",,3 ratings,"   #4,168 in Computers & Accessories ( See Top 100 in Computers & Accessories )      #453 in  Traditional Laptop Computers     ",3.5 out of 5 stars
B096D57WQX,"June 1, 2021",No discount,$399.00,"2021 Newest HP Premium 14-inch HD Laptop, Intel Dual-Core Processor Up to 2.8GHz, 16GB RAM, 64GB eMMC Storage, Webcam, Bluetooth, HDMI, Wi-Fi, Blue, Windows 10 with 1 Year Microsoft 365",122 answered questions,"1,618 ratings","   #3,457 in Computers & Accessories ( See Top 100 in Computers & Accessories )      #368 in  Traditional Laptop Computers     ",4.3 out of 5 stars
B09RNG4XDP,"February 1, 2022",No discount,$539.99,"2022 Newest Acer Aspire 5 Slim Laptop, 15.6"" Full HD IPS, AMD Ryzen 3 3350U Quad-Core Processor, 12 GB DDR4 RAM, 512 GB SSD, Intel WiFi 6, Backlit KB, Fingerprint Reader, Amazon Alexa, Windows 11",19 answered questions,157 ratings,"   #6,469 in Computers & Accessories ( See Top 100 in Computers & Accessories )      #769 in  Traditional Laptop Computers     ",4.7 out of 5 stars
B09NPZ8Y8T,"December 17, 2021",No discount,$869.99,"Newest HP Laptop, 17.3"" FHD (1920 x 1080) IPS Display, i5-1135G7 (> i7-1065G7) up to 4.2GHz, HP Fast Charge, Intel Iris Xe Graphics, Webcam, Type-C, w/Mouse Pad (32GB RAM |1TB PCIe SSD)",,2 ratings,"   #23,994 in Computers & Accessories ( See Top 100 in Computers & Accessories )      #3,964 in  Traditional Laptop Computers     ",5.0 out of 5 stars
B07RSZTLYV,"May 14, 2019",No discount,$587.99,"Dell Latitude 5300 13.3"" Notebook - 1920 X 1080 - Core i5-8365U - 8GB RAM - 256GB SSD",4 answered questions,1 rating,"   #11,381 in Computers & Accessories ( See Top 100 in Computers & Accessories )      #1,606 in  Traditional Laptop Computers     ",5.0 out of 5 stars
B08TH8Q8V6,"January 20, 2021",$499.99,$729.99,HP 17.3in HD Touchscreen Laptop 10th Gen Intel i5 8GB RAM 256GB SSD DVDRW Win 10 (Renewed),7 answered questions,20 ratings,"   #18,767 in Computers & Accessories ( See Top 100 in Computers & Accessories )      #2,899 in  Traditional Laptop Computers     ",4.3 out of 5 stars
B09F2L1ZSW,"December 17, 2021",$199.99,$249.99,"Jumper Laptop 11.6 Inch HD Pentium Quad-core (4GB DDR4 RAM,64GB eMMC,Windows 10) Portable Laptop Computer,Includes 1 Year Microsoft office 365 Subscription ,Support 1TB SSD and 256GB TF Card Expansion",14 answered questions,58 ratings,"   #6,919 in Computers & Accessories ( See Top 100 in Computers & Accessories )      #835 in  Traditional Laptop Computers     ",4.1 out of 5 stars
B09L7VZV71,"November 8, 2021",No discount,$259.00,"Windows 10 Laptop Computer, Coolby 14.1 inch 6GB DDR4 / 128GB SSD Notebook PC, Intel J4005 Processor, HD Display, Support WiFi, BT, Long-Lasting Battery for School, Business, Travel",8 answered questions,9 ratings,"   #8,289 in Computers & Accessories ( See Top 100 in Computers & Accessories )      #1,054 in  Traditional Laptop Computers     ",5.0 out of 5 stars
B09SYQJGV4,"February 21, 2022",No discount,$259.00,"Windows 11 Laptop, BiTECOOL 14 inches HD Clear Display Pc Laptops, with Intel Celeron J4005 Dual Core, 6GB LPDDR4 and 128GB SSD, 2.4G WiFi, BT4.0 and Long Lasting Battery, Mic",8 answered questions,17 ratings,"   #3,395 in Computers & Accessories ( See Top 100 in Computers & Accessories )      #355 in  Traditional Laptop Computers     ",3.9 out of 5 stars
B09DW7BB2T,"August 28, 2021",No discount,$539.00,"2021 Full HD Laptop, AMD Ryzen 5-5500u Processor, 8GB DDR4 RAM, 256GB SSD, Bluetooth, Wi-Fi, HDMI, Windows 10, W/ MD Accessories, Silver, 15-15.99 inches (HP 15 laptop)",,7 ratings,"   #69,868 in Computers & Accessories ( See Top 100 in Computers & Accessories )      #13,508 in  Traditional Laptop Computers     ",5.0 out of 5 stars
B0876H4VHJ,"May 3, 2020",No discount,$554.20,"HP 15 Laptop, AMD Ryzen 7 3700U Processor, 8 GB RAM, 256 GB SSD, HD Display, Windows 10 Home (15-ef0022nr, Natural Silver)",24 answered questions,296 ratings,"   #8,028 in Computers & Accessories ( See Top 100 in Computers & Accessories )      #1,011 in  Traditional Laptop Computers     ",4.5 out of 5 stars
B09N8LPP19,"December 8, 2021",No discount,"$1,099.99","Dell Inspiron 13.3"" QHD Thin Light Laptop 2022 Newest Business, Intel Core i7-11370H Up to 4.8GHz,16GB RAM, 1TB PCIE SSD, NVIDIA GeForce MX450, Fingerprint, Backlit Keyboard, WiFi 6, WINS10",,3 ratings,"   #11,376 in Computers & Accessories ( See Top 100 in Computers & Accessories )      #1,605 in  Traditional Laptop Computers     ",4.6 out of 5 stars
B09MHQSBPP,"November 24, 2021",No discount,$379.00,"2022 Newest Lenovo IdeaPad 3 Laptop, 15.6"" FHD Display, Intel Quad-Core Processor, Intel UHD Graphics, 4GB RAM, 128GB PCIe SSD, Bluetooth 5.0, Windows 11, Office 365 1-Year Subscription Included",3 answered questions,15 ratings,"   #5,183 in Computers & Accessories ( See Top 100 in Computers & Accessories )      #593 in  Traditional Laptop Computers     ",4.0 out of 5 stars
B09RRSPNW3,"February 3, 2022",No discount,$429.00,"2022 Newest HP Premium 14-inch HD Touchscreen Laptop, Intel Dual-Core Processor Up to 2.8GHz, 16GB RAM, 64GB eMMC Storage, Webcam, Bluetooth, HDMI, Wi-Fi, Rose Gold, Win 10 with 1 Year Microsoft 365",6 answered questions,22 ratings,"   #1,941 in Computers & Accessories ( See Top 100 in Computers & Accessories )      #194 in  Traditional Laptop Computers     ",4.1 out of 5 stars
B08S9MKMX8,"March 23, 2020","$1,049.99","$1,299.99","2021 ASUS TUF FX706 VR Ready Gaming Laptop, 17.3"" 144Hz FHD, Intel 11th Gen i5-11260H 6-Core Processor, NVIDIA GeForce RTX 3050, 16GB DDR4 RAM, 1TB PCIe SSD, RGB Backlit KB, Win10+Oydisen Cloth",27 answered questions,63 ratings,"   #15,078 in Computers & Accessories ( See Top 100 in Computers & Accessories )      #2,257 in  Traditional Laptop Computers     ",4.4 out of 5 stars
B09RMJ93C3,"February 1, 2022",No discount,$499.00,"2021 Newest HP 15.6"" FHD IPS Flagship Laptop, 11th Gen Intel Core i3-1115G4(Up to 4.1GHz, Beat i7-8565U), 16GB RAM, 512GB SSD, Fingerprint, Ethernet, Webcam, WiFi, HDMI, Fast Charge,w/GM Accessories",4 answered questions,5 ratings,"   #10,495 in Computers & Accessories ( See Top 100 in Computers & Accessories )      #1,449 in  Traditional Laptop Computers     ",4.7 out of 5 stars
B09J4YL4ZR,"October 11, 2021",No discount,$569.99,"DaySky Windows 10 Laptops, 15.6 Inches FHD, Intel Celeron N5095 Quad-Core 10nm Processor, Full Size Keyboard, 5mm Narrow Bezel, WiFi, USB 3.0, Type C Computer (12GB+512GB, Red)",3 answered questions,27 ratings,"   #20,267 in Computers & Accessories ( See Top 100 in Computers & Accessories )      #3,188 in  Traditional Laptop Computers     ",3.8 out of 5 stars
B09NPZ8Y8T,"December 17, 2021",No discount,$869.99,"Newest HP Laptop, 17.3"" FHD (1920 x 1080) IPS Display, i5-1135G7 (> i7-1065G7) up to 4.2GHz, HP Fast Charge, Intel Iris Xe Graphics, Webcam, Type-C, w/Mouse Pad (32GB RAM |1TB PCIe SSD)",,2 ratings,"   #23,994 in Computers & Accessories ( See Top 100 in Computers & Accessories )      #3,964 in  Traditional Laptop Computers     ",5.0 out of 5 stars
B088T671HD,"May 19, 2020",$429.00,$559.99,"2020 Lenovo IdeaPad 3 15.6"" Laptop Intel Core i3-1005G1 8GB RAM 256GB SSD Windows 10 in S Mode Blue, 4-10.99 Inches",37 answered questions,247 ratings,"   #22,719 in Computers & Accessories ( See Top 100 in Computers & Accessories )      #3,698 in  Traditional Laptop Computers     ",4.5 out of 5 stars
B09J16YN5Z,"October 8, 2021",No discount,$519.99,"DERE Laptop with Backlit Keyboard 15.6"" Traditional Laptop Computers with Fingerprint Reader, Intel Celeron N5095 CPU 12GB DDR4 256GB SSD, 1920x1080 FHD, Windows 10, 5G WiFi, USB 3.0 MBook M11 Red",19 answered questions,14 ratings,"   #41,583 in Computers & Accessories ( See Top 100 in Computers & Accessories )      #7,317 in  Traditional Laptop Computers     ",4.0 out of 5 stars
B0922L7596,"April 8, 2021",No discount,$745.00,"Lenovo IdeaPad 3 17 Laptop 17.3” HD+ Display, Intel 10th Gen Quad-Core i5-1035G1, 12GB RAM, 128GB SSD + 1TB HDD, Webcam, Dolby Audio, USB 3.0, HDMI, Abyss Blue, Windows 10 Home",3 answered questions,14 ratings,"   #50,945 in Computers & Accessories ( See Top 100 in Computers & Accessories )      #9,272 in  Traditional Laptop Computers     ",4.3 out of 5 stars
B08XPB337W,"May 12, 2021",No discount,"$2,149.00","ASUS ROG Strix G15 (2021) Gaming Laptop, 15.6” 300Hz IPS Type FHD Display, NVIDIA GeForce RTX 3070, AMD Ryzen R9-5900HX, 32GB DDR4, 1TB PCIe SSD, Per-Key RGB Keyboard, Windows 10, G513QR-AS98",78 answered questions,143 ratings,"   #13,533 in Computers & Accessories ( See Top 100 in Computers & Accessories )      #2,006 in  Traditional Laptop Computers     ",4.5 out of 5 stars
B09FPDGVS5,"September 8, 2021",No discount,$799.00,"MSI Prestige 14 Evo Professional Laptop: 14"" FHD Ultra-Thin Bezel Display, Intel Core i7-1185G7, Intel Iris Xe, 16GB RAM, 512GB NVMe SSD, Thunderbolt 4, Win10 Home, Intel Evo, Carbon Gray (A11M-629)",50 answered questions,104 ratings,"   #11,103 in Computers & Accessories ( See Top 100 in Computers & Accessories )      #1,551 in  Traditional Laptop Computers     ",4.1 out of 5 stars
B096V6RZ22,"June 16, 2021",,,"ASUS TUF Gaming F17 Gaming Laptop, 17.3” 144Hz Full HD IPS-Type, Intel Core i7-11800H Processor, GeForce RTX 3060, 16GB DDR4, 1TB PCIe SSD, Gigabit Wi-Fi 6, Windows 10 Home, TUF706HM-ES76",50 answered questions,77 ratings,"   #7,521 in Computers & Accessories ( See Top 100 in Computers & Accessories )      #920 in  Traditional Laptop Computers     ",4.4 out of 5 stars
B09L6VNZ29,"November 7, 2021",No discount,$229.00,"Laptop 14.1 inch Notebook Computer, IPS Display, 64-bit Quad-core celeron_j3455 Processor, 6GB RAM, 128GB SSD ROM, scalable 1TB SSD Solid State Drive, Windows 10 OS",,2 ratings,"   #56,094 in Computers & Accessories ( See Top 100 in Computers & Accessories )      #10,380 in  Traditional Laptop Computers     ",4.0 out of 5 stars
B09MJQ9P4W,"November 24, 2021",,,"2022 HP High Performance Business Laptop - 17.3"" HD+ Touchscreen - 11th Intel i7-1165G7 Iris Xe Graphics - 32GB DDR4 - 1TB SSD - WiFi 6 Bluetooth - Backlit Keybard - Win 11 Pro w/ 32GB USB",10 answered questions,25 ratings,"   #14,126 in Computers & Accessories ( See Top 100 in Computers & Accessories )      #2,112 in  Traditional Laptop Computers     ",4.5 out of 5 stars
B07RSZTLYV,"May 14, 2019",No discount,$587.99,"Dell Latitude 5300 13.3"" Notebook - 1920 X 1080 - Core i5-8365U - 8GB RAM - 256GB SSD",4 answered questions,1 rating,"   #11,381 in Computers & Accessories ( See Top 100 in Computers & Accessories )      #1,606 in  Traditional Laptop Computers     ",5.0 out of 5 stars
B09LHKY4LF,"November 10, 2021",No discount,$539.99,"TECLAST Notebook Laptop 12GB RAM 256GB SSD, 15.6'' FHD IPS Display, Intel Ice Lake Core i3-1005G1 Windows 10 Laptops Computers, Support Update Windows 11, HDMI, USB3.0, WiFi, BT, Long Battery Life",62 answered questions,82 ratings,"   #46,352 in Computers & Accessories ( See Top 100 in Computers & Accessories )      #8,299 in  Traditional Laptop Computers     ",4.1 out of 5 stars
B09KYJSTH2,"November 3, 2021",No discount,$549.00,"2022 Newest HP Premium Laptop, 15.6"" HD LED Display, AMD Dual-Core Processor, AMD Radeon Graphics, 16GB RAM, 1TB SSD, 3 in 1 Business Bundle, HDMI, USB Type-C, Long Battery Life, Windows 10, Silver",4 answered questions,49 ratings,"   #15,665 in Computers & Accessories ( See Top 100 in Computers & Accessories )      #2,346 in  Traditional Laptop Computers     ",4.4 out of 5 stars
B09S9SZ8CV,"February 10, 2022",No discount,$549.99,"2022 Newest Acer Aspire 5 15.6"" FHD IPS Slim Laptop, AMD Ryzen 3 3350U 4-Core Processor(Up to 3.5GHz) 20GB RAM, 512GB NVMe SSD, Backlit KB, Fingerprint Reader, Amazon Alexa, Win 11 S, 3in1 Accessories",16 answered questions,46 ratings,"   #2,899 in Computers & Accessories ( See Top 100 in Computers & Accessories )      #292 in  Traditional Laptop Computers     ",4.3 out of 5 stars
B08R25BBVF,"December 19, 2020",No discount,$479.00,"2021 HP 15.6"" HD Touchscreen Laptop, AMD Ryzen 3 3250U Processor, 4GB RAM, 256GB SSD, Backlit Keyboard, HDMI, AMD Radeon Graphics, Windows 10 S, Natural Silver, W/ IFT Accessories",,11 ratings,"   #71,225 in Computers & Accessories ( See Top 100 in Computers & Accessories )      #13,847 in  Traditional Laptop Computers     ",4.0 out of 5 stars
B08HCM9RRN,"September 3, 2020",,,"HP 17.3"" Non-Touch Laptop Intel 10th Gen i5-1035G1, 1TB Hard Drive, 12GB Memory, DVD Writer, Backlit Keyboard, Windows 10 Home Silver",56 answered questions,222 ratings,"   #6,711 in Computers & Accessories ( See Top 100 in Computers & Accessories )      #804 in  Traditional Laptop Computers     ",4.2 out of 5 stars
B09JGSWN1W,"January 23, 2022",$699.99,$749.99,"Acer Aspire 5 A517-52-58UL Laptop | 17.3"" Full HD IPS Display | 11th Gen Intel Core i5-1135G7 | Intel Iris Xe Graphics | 8GB DDR4 | 512GB SSD | WiFi 6 | Fingerprint Reader | BL Keyboard | Windows 11",,,"   #23,738 in Computers & Accessories ( See Top 100 in Computers & Accessories )      #3,911 in  Traditional Laptop Computers     ",
B09CZCGH5N,"August 17, 2021",No discount,$609.99,"Newest 2021 HP 17.3inch FHD Laptop, 11th Core i5-1135G7 (>i7-1065G7), 8GB RAM, 256GB PCIe SSD, Iris Xe Graphics, Webcam, HDMI, Win 10 Home, w/ Accessories 17-by4633dx",,5 ratings,"   #54,042 in Computers & Accessories ( See Top 100 in Computers & Accessories )      #9,935 in  Traditional Laptop Computers     ",4.8 out of 5 stars
B09M6ZWJPL,"November 18, 2021",No discount,$499.00,"2021 Newest HP 15.6"" Micro-Edge HD Laptop, Intel Core i3-1115G4 up to 4.1GHz (Beat i5-1035G4), 16GB RAM, 512GB NVMe SSD, Numpad, Lightweight, WiFi, Bluetooth, Webcam, Fast Charge, HDMI, Win10 S",6 answered questions,52 ratings,"   #12,113 in Computers & Accessories ( See Top 100 in Computers & Accessories )      #1,759 in  Traditional Laptop Computers     ",4.5 out of 5 stars
B081FDK94Y,"November 13, 2019",No discount,$673.00,"2021 Newest Dell Inspiron 15 3000 3501 Laptop, 15.6"" Full HD 1080P Screen, 11th Gen Intel Core i5-1135G7 Quad-Core Processor, 16GB RAM, 256GB SSD + 1TB HDD, Webcam, HDMI, Wi-Fi, Windows 10 Home, Black",12 answered questions,98 ratings,"   #2,246 in Computers & Accessories ( See Top 100 in Computers & Accessories )      #223 in  Traditional Laptop Computers     ",4.4 out of 5 stars
B096CQSC8Q,"June 1, 2021",No discount,$399.00,"2021 Newest HP Premium 14-inch HD Laptop, Intel Dual-Core Processor Up to 2.8GHz, 16GB RAM, 64GB eMMC Storage, Webcam, Bluetooth, HDMI, Wi-Fi, Rose Gold, Windows 10 with 1 Year Microsoft 365",122 answered questions,"1,618 ratings","   #1,856 in Computers & Accessories ( See Top 100 in Computers & Accessories )      #189 in  Traditional Laptop Computers     ",4.3 out of 5 stars
B09T4SN1NY,"February 22, 2022",No discount,$499.00,"2022 Newest HP Notebook 15 Laptop, 15.6"" HD Screen, Intel Celeron N4020 Processor, Webcam, USB Type-C, RJ-45, HDMI, Windows 11 Home, Silver (16GB RAM | 512GB SSD)",5 answered questions,30 ratings,"   #5,556 in Computers & Accessories ( See Top 100 in Computers & Accessories )      #647 in  Traditional Laptop Computers     ",4.4 out of 5 stars
B0985P1XMW,"June 28, 2021",No discount,$499.00,"2021 Newest HP Pavilion 15.6"" HD Laptop, Intel Quad-core Pentium Processor, 16GB RAM, 512GB SSD, Intel UHD Graphics, HD Webcam, Bluetooth, HDMI, USB Type-C, Scarlet Red, Windows 10",8 answered questions,83 ratings,"   #16,564 in Computers & Accessories ( See Top 100 in Computers & Accessories )      #2,495 in  Traditional Laptop Computers     ",4.2 out of 5 stars
B08777BH1B,"June 1, 2020",No discount,"$1,199.99","Acer Nitro 5 Gaming Laptop, 9th Gen Intel Core i7-9750H, NVIDIA GeForce RTX 2060, 15.6"" Full HD IPS 144Hz Display, 16GB DDR4, 256GB NVMe SSD, Wi-Fi 6, Waves MaxxAudio, Backlit Keyboard, AN515-54-728C",181 answered questions,"1,143 ratings","   #6,464 in Computers & Accessories ( See Top 100 in Computers & Accessories )      #768 in  Traditional Laptop Computers     ",4.6 out of 5 stars
B09J546WMW,"November 10, 2021",No discount,$529.99,"DAYSKY Laptops Computer, 15.6 inch FHD Display, 12GB DDR4 RAM 256GB SSD, Fingerprint Recognition, Backlit Number Keyboard , All Metal Body, Intel Celeron N5095 10nm Processor, Windows 10, Red",20 answered questions,72 ratings,"   #9,802 in Computers & Accessories ( See Top 100 in Computers & Accessories )      #1,320 in  Traditional Laptop Computers     ",3.8 out of 5 stars
B09LC45LBW,"August 26, 2021",No discount,$679.00,"HP Pavilion Laptop Computer 17.3 inch FHD IPS, 11th Gen Intel Core i5-1135G7(Beat i7-1065G7), 16GB DDR4, 512GB SSD, Backlit Keyboard, Wi-Fi, Bluetooth, Webcam, HDMI, Windows 11 Home, ABYS Mouse Pad",,3 ratings,"   #148,707 in Electronics ( See Top 100 in Electronics )      #16,313 in  Computers & Tablets     ",5.0 out of 5 stars
B09R9T5JJV,"November 17, 2021",No discount,$859.99,"2022 Newest HP Laptop, 17.3"" FHD IPS 100% sRGB Display, Intel Core i5-1135G7 (> i7-1065G7) up to 4.2GHz, Intel Iris Xe Graphics, Webcam, Backlit KB, HP Fast Charge, Win 11 (32GB RAM | 1TB PCIe SSD)",,4 ratings,"   #25,990 in Computers & Accessories ( See Top 100 in Computers & Accessories )      #4,341 in  Traditional Laptop Computers     ",5.0 out of 5 stars
B098Z6H3J5,"July 8, 2021",No discount,$699.00,"Lenovo IdeaPad Thin and Light Laptop, 15.6"" FHD Display, AMD Ryzen 5 5500U Processor (Beats i7-1185G7), 20GB RAM, 512GB PCIe SSD, Backlit Keyboard, Fingerprint Reader, Windows 11, Sand (Latest Model)",15 answered questions,129 ratings,"   #11,545 in Computers & Accessories ( See Top 100 in Computers & Accessories )      #1,640 in  Traditional Laptop Computers     ",4.5 out of 5 stars
B08DDJB4T5,"July 21, 2020",No discount,"$1,219.00","ASUS ROG Zephyrus G14 14"" VR Ready FHD Gaming Laptop,8cores AMD Ryzen 7 4800HS(Beat i7-10750H),16GB RAM,1TB PCIe SSD, Backlight, Wi-Fi 6,USB Type C,HDMI,NVIDIA GeForce GTX1650,Win10(Eclipse Gray)",74 answered questions,205 ratings,"   #15,280 in Computers & Accessories ( See Top 100 in Computers & Accessories )      #2,288 in  Traditional Laptop Computers     ",4.4 out of 5 stars
B08LD2DW3X,"September 10, 2020",,,"HP 17.3"" Non-Touch Laptop Intel 10th Gen i5-10210U, 1TB Hard Drive, 12GB Memory, DVD Writer, Backlit Keyboard, Windows 10 Home Silver",24 answered questions,117 ratings,"   #18,966 in Computers & Accessories ( See Top 100 in Computers & Accessories )      #2,925 in  Traditional Laptop Computers     ",3.9 out of 5 stars
B09QM6FMJM,"January 30, 2021",No discount,$849.00,"2022 Newest HP 15.6"" FHD Touchscreen Laptop, 11th Gen Intel Core i5-1135G7 up to 4.2 GHz(Best i7-1060G7), 16GB RAM, 1TB NVMe SSD, Intel Iris Xe Graphics, Numpad, HDMI, Type A&C, Webcam, Win11 S",,17 ratings,"   #22,973 in Computers & Accessories ( See Top 100 in Computers & Accessories )      #3,753 in  Traditional Laptop Computers     ",4.3 out of 5 stars
B09VY879NW,"March 18, 2022",No discount,$499.98,"2022 ASUS Vivobook 14 in Laptop FHD Display| Intel Core i3-1115G4 Up to 4.1GHz (Beat i5-1035G4)| Fingerprint | 12GB RAM, 512GB SSD | Intel UHD Graphics | Windows 10 + CUE Accessories",,,"   #8,032 in Computers & Accessories ( See Top 100 in Computers & Accessories )      #1,012 in  Traditional Laptop Computers     ",
B0978SZN34,"June 15, 2021",No discount,$629.99,"2021 Newest Lenovo Ideapad 3 15.6"" Premium FHD Laptop, 6-core AMD Ryzen 5 5500U(up to 4.0GHz), 8GB RAM 512GB NVMe SSD, AMD Radeon 7, up to 12 Hours, Webcam HDMI Win 10",,9 ratings,"   #27,864 in Computers & Accessories ( See Top 100 in Computers & Accessories )      #4,684 in  Traditional Laptop Computers     ",4.6 out of 5 stars
B08KTSXCWG,"October 7, 2020",$199.00,$339.99,HP LAPTOP 14 inchesHD AMD 3020E 4 64GB eMMC Snowflake White 14-fq0070nr (Renewed),,4 ratings,"   #51,291 in Computers & Accessories ( See Top 100 in Computers & Accessories )      #9,338 in  Traditional Laptop Computers     ",4.7 out of 5 stars
