ASIN,Date_first_available,Discounted_price,Listing_price,Name,Number_of_answered_questions,Number_of_reviews,Product_Rank,Rating
B09SZPSTN1,"February 21, 2022",No discount,$529.00,"2022 Newest HP 15 Laptop, 15.6"" HD LED Display, Intel Dual-Core Processor, Intel UHD Graphics, 16GB DDR4 RAM, 1TB SSD, Ethernet Port, USB Type-C, Long Battery Life, Windows 11",6 answered questions,18 ratings,   #998 in Computers & Accessories ( See Top 100 in Computers & Accessories )      #92 in  Traditional Laptop Computers     ,4.4 out of 5 stars
B091DBY1JT,"March 30, 2021",,,"HP Envy 17 Laptop, 11th Gen Intel Core i7-1165G7, 12 GB RAM, 1 TB SATA Hard Drive & 256 GB SSD Storage, 17.3-inch Full HD IPS Touchscreen, Windows 10 Home, HD Webcam, Audio by B&O (17-cg1010nr, 2021)",13 answered questions,23 ratings,"   #7,444 in Computers & Accessories ( See Top 100 in Computers & Accessories )      #908 in  Traditional Laptop Computers     ",4.7 out of 5 stars
B09XBS3S5J,"April 6, 2022",No discount,$939.00,"HP Pavilion 15.6"" FHD IPS Laptop (2022 Model), 8-Core AMD Ryzen 7 5700U (Beats i9-10885H), 32GB RAM, 1TB NVMe SSD, Audio by B&O, Wi-Fi 6, Compact Design, Long Battery Life, Micro-Edge, Win11",,,"   #33,408 in Computers & Accessories ( See Top 100 in Computers & Accessories )      #5,786 in  Traditional Laptop Computers     ",
B09T2Q84CW,"February 22, 2022",,,Newest HP Envy 2-in-1 Laptop 15.6 inch FHD Touchscreen 8-Core AMD Ryzen 7 5700U Radeon Graphics 32GB DDR4 1TB NVMe SSD WI-FI 6 Win 11 Pro Fingerprint Backlit Numpad Keyboard w/ 32GB USB Drive,,9 ratings,"   #35,648 in Computers & Accessories ( See Top 100 in Computers & Accessories )      #474 in  2 in 1 Laptop Computers     ",4.5 out of 5 stars
B09MHBCTM2,"November 25, 2021",No discount,"$1,669.90","Lenovo Legion 5 17.3"" 300Nits 144Hz Gaming Laptop, FHD (1920x1080) IPS Display, Octa-Core AMD Ryzen 7 5800H, NVIDIA GeForce RTX 3060 6GB GDDR6(TGP 130W), Webcam, Windows 11 (32GB RAM | 2TB PCIe SSD)",,1 rating,"   #29,910 in Computers & Accessories ( See Top 100 in Computers & Accessories )      #5,065 in  Traditional Laptop Computers     ",4.0 out of 5 stars
B09WP1ZY2C,"March 28, 2022",No discount,$419.00,"2022 Newest HP 15.6"" HD Laptop Computer, 11th Gen Intel Quad-Core i3-1125G4(Up to 3.7GHz, Beat i5-10210U),128GB SSD, 8GB RAM, Webcam, Bluetooth, USB-C, Wi-Fi, HDMI, Windows 11S, Silver+JVQ Mousepad",22 answered questions,76 ratings,"   #4,271 in Electronics ( See Top 100 in Electronics )      #304 in  Computers & Tablets     ",4.5 out of 5 stars
B08278SPNS,"December 1, 2019",No discount,$199.99,"HP Stream 14inch Touchscreen Laptop, AMD A4-9120 Processor, 4GB DDR4 RAM, 64GB SSD, AMD Radeon R3 Graphics, WiFi, Bluetooth, HDMI, Win10 (Renewed) (Royal Blue/64GB/Touch)",9 answered questions,170 ratings,"   #1,043 in Computers & Accessories ( See Top 100 in Computers & Accessories )      #96 in  Traditional Laptop Computers     ",4.1 out of 5 stars
B0947BJ67M,"May 30, 2021",No discount,$222.99,"HP 14 Laptop, Intel Celeron N4020, 4 GB RAM, 64 GB Storage, 14-inch Micro-edge HD Display, Windows 10 Home, Thin & Portable, 4K Graphics, One Year of Microsoft 365 (14-dq0040nr, 2021, Snowflake White)",12 answered questions,79 ratings,   #464 in Computers & Accessories ( See Top 100 in Computers & Accessories )      #49 in  Traditional Laptop Computers     ,4.8 out of 5 stars
B09HVC79PC,"December 9, 2021",$369.99,$399.99,"Acer Aspire 5 A515-46-R3UB | 15.6"" Full HD IPS Display | AMD Ryzen 3 3350U Quad-Core Mobile Processor | 4GB DDR4 | 128GB NVMe SSD | WiFi 6 | Backlit KB | FPR | Amazon Alexa | Windows 11 Home in S mode",330 answered questions,"35,044 ratings",   #53 in Computers & Accessories ( See Top 100 in Computers & Accessories )      #1 in  Traditional Laptop Computers     ,4.6 out of 5 stars
B09WY6FLYG,"March 31, 2022",No discount,$20.99,"USB 3.0 Flash Drive, LUNANI 1TB USB Drives High Read Speed Thumb Drive 1000GB Swivel Design Memory Stick 1 Terabyte Jump Drive for Computer/Laptop Black",12 answered questions,425 ratings,   #59 in  USB Flash Drives     ,4.3 out of 5 stars
B09SJZDPY6,"February 15, 2022",No discount,$509.00,"2022 Newest Dell Inspiron 3510 Laptop, 15.6 HD Display, Intel Celeron N4020 Processor, 16GB DDR4 RAM, 1TB HDD, Webcam, WiFi, HDMI, Bluetooth, Win10 Home, Black",17 answered questions,78 ratings,"   #3,129 in Computers & Accessories ( See Top 100 in Computers & Accessories )      #324 in  Traditional Laptop Computers     ",4.6 out of 5 stars
B09M7LQVQ9,"November 18, 2021",No discount,$749.00,"Lenovo IdeaPad 15.6"" FHD Touchscreen Laptop, Intel Core i5-1135G7 Quad-Core Processor (Beats i7-1065G7), Intel Iris Xe Graphics, 20GB RAM, 512GB PCIe SSD, Backlit Keyboard, Fingerprint Reader, Win11",28 answered questions,77 ratings,   #934 in Computers & Accessories ( See Top 100 in Computers & Accessories )      #84 in  Traditional Laptop Computers     ,4.4 out of 5 stars
B09MZQ7VJK,"December 3, 2021",No discount,"$1,799.99","Microsoft Surface Laptop 4 15"" Touch Screen - Intel Core i7 - 16GB - 512GB with Windows 11 (Latest Model) - Black",,,"   #3,676 in Computers & Accessories ( See Top 100 in Computers & Accessories )      #397 in  Traditional Laptop Computers     ",
B09NL9XTY5,"December 13, 2021",No discount,$679.00,"HP Pavilion 15.6"" FHD Laptop (2022 Latest Model), AMD Ryzen 5 5500U (Beats i7-11370H), 16GB RAM, 1TB PCIe NVMe M.2 SSD, Thin & Portable, Micro-Edge & Anti-Glare Screen, Long Battery Life, Windows 11",42 answered questions,462 ratings,"   #1,703 in Computers & Accessories ( See Top 100 in Computers & Accessories )      #166 in  Traditional Laptop Computers     ",4.4 out of 5 stars
B09LYRNCM8,"November 16, 2021",No discount,$605.98,"New hp Laptop 17.3"" FHD IPS Display i5 Laptop, 11th Gen Quad-Core Intel Core i5-1135G7(Beats i7-8500), Backlit Keyboard, Bundle with HDMI, Windows 11 Home, Silver",13 answered questions,24 ratings,"   #1,286 in Computers & Accessories ( See Top 100 in Computers & Accessories )      #122 in  Traditional Laptop Computers     ",4.5 out of 5 stars
B09DCJ5JF1,"September 1, 2021",No discount,"$1,431.98","Dell Inspiron 7610 16 Inch Business and Student Laptop - 3K (3072x1920) Display, Intel Core i7-11800H, 16GB DDR4 RAM, 512GB SSD, NVIDIA GeForce RTX 3050 4GB GDDR6, Windows 11 Pro - Mist Blue",9 answered questions,5 ratings,"   #3,509 in Computers & Accessories ( See Top 100 in Computers & Accessories )      #376 in  Traditional Laptop Computers     ",4.3 out of 5 stars
B09VPYXGKW,"March 16, 2022",No discount,"$1,099.00","Lenovo Newest 2022 ThinkPad E15 Gen 2 Business Laptop, 15.6"" Full HD Display, Intel Core i5-1135G7 Processor, 16GB RAM, 1TB SSD, Backlit Keyboard, Fingerprint Reader, Wi-Fi 6, Windows 11 Pro",,,"   #14,734 in Computers & Accessories ( See Top 100 in Computers & Accessories )      #2,203 in  Traditional Laptop Computers     ",
B013HD3FDK,"August 5, 2015",No discount,$240.99,Apple MacBook Air MJVM2LL/A 11.6-Inch 128GB Laptop (Renewed),79 answered questions,323 ratings,   #946 in Computers & Accessories ( See Top 100 in Computers & Accessories )      #86 in  Traditional Laptop Computers     ,4.3 out of 5 stars
B09PFD48X5,"December 29, 2021",No discount,$869.00,"Newest HP Notebook Laptop, 17.3’’ Full HD Display, 11th Gen Intel Core i5-1155G7 Quad-Core Processor, 32GB RAM, 1TB PCIe M.2 SSD, Backlit Keyboard, Webcam, Wi-Fi, Bluetooth, Windows 11 Home",4 answered questions,7 ratings,"   #14,331 in Computers & Accessories ( See Top 100 in Computers & Accessories )      #2,147 in  Traditional Laptop Computers     ",4.8 out of 5 stars
B09B78RSVL,"July 27, 2021",$239.00,$239.00,"CHUWI HeroBook Air 11.6"" Windows 10 Laptop, Intel Celeron N4020 Processor, 4GB LPDDR4 RAM, 128GB SSD, HD Display, WiFi, Webcam, Ultra Slim and Light Notebook PC for School Student",60 answered questions,175 ratings,"   #1,269 in Computers & Accessories ( See Top 100 in Computers & Accessories )      #118 in  Traditional Laptop Computers     ",3.9 out of 5 stars
B09LCGRL9V,"November 9, 2021",No discount,$959.99,"ASUS ZenBook 14 Ultra-Slim Laptop 14” FHD Display, AMD Ryzen 7 5800H CPU, Radeon Vega 7 Graphics, 16GB RAM, 1TB PCIe SSD, NumberPad, Windows 11 Pro, Pine Grey, UM425QA-EH74",7 answered questions,14 ratings,"   #3,844 in Computers & Accessories ( See Top 100 in Computers & Accessories )      #420 in  Traditional Laptop Computers     ",4.5 out of 5 stars
B08YWX4W7G,"March 13, 2021",,,Microsoft Surface Laptop 4 13.5” Touch-Screen – AMD Ryzen 5 Surface Edition - 8GB Memory - 256GB Solid State Drive  - Platinum,80 answered questions,379 ratings,"   #1,456 in Computers & Accessories ( See Top 100 in Computers & Accessories )      #143 in  Traditional Laptop Computers     ",4.6 out of 5 stars
B09QM394Y8,"January 18, 2022",$249.00,$299.99,"ASUS Laptop L510 Ultra Thin Laptop, 15.6” FHD Display, Intel Pentium Silver N5030 Processor, 4GB RAM, 128GB Storage, Windows 11 Home in S Mode, 1 Year Microsoft 365, Star Black, L510MA-DH21",490 answered questions,"6,491 ratings","   #1,431 in Computers & Accessories ( See Top 100 in Computers & Accessories )      #139 in  Traditional Laptop Computers     ",4.3 out of 5 stars
B09B782V81,"July 27, 2021",$389.00,$459.00,"CHUWI LarkBook X 14"" Touchscreen Laptop (2240x1400P Full-Laminated Screen) 8GB RAM 256GB SSD, Intel Celeron N5100 Quad Core, Backlit Keyboard, WiFi Type-C, Windows 10 Business Notebook PC, Metal Gray",37 answered questions,100 ratings,"   #7,400 in Computers & Accessories ( See Top 100 in Computers & Accessories )      #903 in  Traditional Laptop Computers     ",3.9 out of 5 stars
B08F3TNHFJ,"August 1, 2020",No discount,$185.00,"HP Stream 9VK97UA#ABA 14 inches HD(1366x768) Display, Intel Celeron N4000 Dual-Core Processor, 4GB RAM, 64GB eMMC, HDMI, WiFi, Webcam, Bluetooth, Win10 S, Royal Blue (Renewed)",61 answered questions,829 ratings,   #381 in Computers & Accessories ( See Top 100 in Computers & Accessories )      #40 in  Traditional Laptop Computers     ,4.4 out of 5 stars
B09SV1T3WL,"February 18, 2022",No discount,$179.99,"Projector with WiFi and Bluetooth, HD 1080P Home Outdoor Movie Projector 4K Support Screen Mirroring, WeChip Max 300"" 8500L Portable Projector Compatible with HDMI,VGA,Laptop,iOS & Android Smartphone",26 answered questions,68 ratings,   #356 in  Video Projectors     ,4.3 out of 5 stars
B09TMJB229,"June 30, 2021",No discount,$359.99,2022 Newest HP Premium 14-inch HD Laptop| Intel Celeron N4020 to 2.8GHz 8GB RAM 128GB(64GB SSD+ 64GB Card)| Webcam Bluetooth HDMI USB-C Wi-Fi| Win 11 S with 1 Year MS 365| LIONEYE Bundle| White,11 answered questions,41 ratings,   #866 in Computers & Accessories ( See Top 100 in Computers & Accessories )      #80 in  Traditional Laptop Computers     ,4.6 out of 5 stars
B08QY6JK4D,"December 18, 2020",No discount,$839.00,"2021 Newest Dell Inspiron 15 3000 Business Laptop, 15.6"" Full HD Touchscreen, Intel Core i5-1035G1, 16GB DDR4 RAM, 1TB PCIE SSD, Online Meeting Ready, Webcam, Wi-Fi, HDMI, Windows 10 Pro, Black",,4 ratings,"   #6,727 in Computers & Accessories ( See Top 100 in Computers & Accessories )      #806 in  Traditional Laptop Computers     ",5.0 out of 5 stars
B07C1DK3SS,"March 22, 2018",No discount,$269.00,"Dell Latitude 2018, E6440 Business High Performance 14in Laptop, Intel Core i5-4300M Processor up to 3.3GHz, 8GB RAM, DVD+/-RW, 256GB SSD, Windows 10 Professional (Renewed)",49 answered questions,193 ratings,"   #14,201 in Computers & Accessories ( See Top 100 in Computers & Accessories )      #2,124 in  Traditional Laptop Computers     ",3.7 out of 5 stars
B091GGZT1S,"April 1, 2021","$1,099.99","$1,399.00","MSI Stealth 15M Gaming Laptop: 15.6"" 144Hz FHD 1080p Display, Intel Core i7-11375H, NVIDIA GeForce RTX 3060, 16GB, 512GB SSD, Thunderbolt 4, WiFi 6, Win10, Carbon Gray (A11UEK-009)",187 answered questions,476 ratings,   #340 in Computers & Accessories ( See Top 100 in Computers & Accessories )      #32 in  Traditional Laptop Computers     ,4.3 out of 5 stars
B09VG36RY2,"March 12, 2022",No discount,$879.99,"Newest Lenovo IdeaPad 5 Business Laptop, 15.6"" FHD IPS Display, 8-core AMD Ryzen 7 5700U, Webcam, 14 hr Battery Life, Fingerprint, Type-C, Backlit KB, Windows 11 Home (16GB RAM | 1TB PCIe SSD)",,,"   #7,889 in Computers & Accessories ( See Top 100 in Computers & Accessories )      #983 in  Traditional Laptop Computers     ",
B07781S5L5,"November 7, 2017",No discount,$60.00,"Dell ChromeBook 11.6 Inch HD (1366 x 768) Laptop NoteBook PC, Intel Celeron N2840, Camera, HDMI, WIFI, USB 3.0, SD Card Reader (Renewed)",199 answered questions,"3,249 ratings",   #275 in Computers & Accessories ( See Top 100 in Computers & Accessories )      #24 in  Traditional Laptop Computers     ,4.1 out of 5 stars
B09V6S3FVX,"March 9, 2022",No discount,$229.99,"2022 Samsung 14” FHD(1920 x 1080) Laptop, Windows 11 OS, Qualcomm Octa Core Snapdragon Processor 2.55GHz, 4GB LPDDR4x, 64GB SSD (Renewed)",4 answered questions,17 ratings,"   #1,435 in Computers & Accessories ( See Top 100 in Computers & Accessories )      #140 in  Traditional Laptop Computers     ",4.3 out of 5 stars
B094K27CSY,"May 10, 2021",No discount,$999.00,"ASUS VivoBook 17 K712EA Thin and Light Laptop, 17.3” FHD Display, Intel Core i7-1165G7, 16GB DDR4 RAM, 1TB PCIe SSD, Windows 10 Home, Fingerprint, Transparent Silver, K712EA-DS76",56 answered questions,103 ratings,"   #4,130 in Computers & Accessories ( See Top 100 in Computers & Accessories )      #448 in  Traditional Laptop Computers     ",4.7 out of 5 stars
B09SM5JT4K,"February 16, 2022",No discount,$999.00,"ASUS TUF VR Ready Gaming Laptop, 17.3"" FHD 144Hz IPS Display, 11th Gen Intel 6-Core i5-11260H(Beat i7-8850H), 16GB DDR4 RAM, 512GB PCIe SSD, GeForce RTX 3050, RGB Backlit Keyboard, Win 10,JVQ MP",,9 ratings,"   #11,414 in Computers & Accessories ( See Top 100 in Computers & Accessories )      #1,614 in  Traditional Laptop Computers     ",4.1 out of 5 stars
B09KZGS7K8,"November 3, 2021",No discount,$499.00,"HP Pavilion Laptop (Latest Model), 15.6"" HD Display, 10th Gen Intel Core i3-10110U Processor (Up to 4.1 GHz), 16GB DDR4 RAM, 256GB SSD, Online Meeting, HD Webcam, USB Type-C, HDMI, Wi-Fi, Windows 10",12 answered questions,123 ratings,"   #52,152 in Computers & Accessories ( See Top 100 in Computers & Accessories )      #9,516 in  Traditional Laptop Computers     ",4.3 out of 5 stars
B084SKWC89,"March 1, 2020",$203.00,$259.99,"HP Stream 14-inch Laptop, Intel Celeron N4000, 4 GB RAM, 64 GB eMMC, Windows 10 Home in S Mode With Office 365 Personal For 1 Year (14-cb185nr, Royal Blue)",364 answered questions,"5,660 ratings",   #336 in Computers & Accessories ( See Top 100 in Computers & Accessories )      #31 in  Traditional Laptop Computers     ,4.5 out of 5 stars
B09DTWQ2H4,"August 3, 2021",$359.00,$399.00,"CHUWI GemiBook Pro 14"" Laptop Computer (2160x1440 Pixels 3:2 Aspect Ratio Screen) 8GB RAM 256GB SSD Intel N5100 Processor, WiFi Type-C, Windows 10 Notebook PC, Portable Design Ideal for Business Work",37 answered questions,106 ratings,"   #11,431 in Computers & Accessories ( See Top 100 in Computers & Accessories )      #1,618 in  Traditional Laptop Computers     ",4.1 out of 5 stars
B098X2NQLD,"July 8, 2021",$706.46,$949.00,"MSI Modern 15A Thin and Light Daily Laptop: 15.6"" FHD 1080p, Intel Core i7-1195G7, Intel Iris Xe, 8GB, 512GB SSD, Win10, Carbon Gray (A11MU-653)",,1 rating,"   #23,814 in Computers & Accessories ( See Top 100 in Computers & Accessories )      #3,925 in  Traditional Laptop Computers     ",5.0 out of 5 stars
B0949SGBF8,"May 30, 2021",No discount,$298.88,"HP 14 Laptop, Intel Celeron N4020, 4 GB RAM, 64 GB Storage, 14-inch HD Touchscreen, Windows 10 Home, Thin & Portable, 4K Graphics, One Year of Microsoft 365 (14-dq0070nr, 2021, Pale Rose Gold)",15 answered questions,145 ratings,   #620 in Computers & Accessories ( See Top 100 in Computers & Accessories )      #57 in  Traditional Laptop Computers     ,4.4 out of 5 stars
B013HD3INW,"August 5, 2015",No discount,$239.99,"Apple MacBook Air MJVE2LL/A 13-inch Laptop 1.6GHz Core i5,4GB RAM,128GB SSD (Renewed)",65 answered questions,376 ratings,"   #2,039 in Computers & Accessories ( See Top 100 in Computers & Accessories )      #202 in  Traditional Laptop Computers     ",4.3 out of 5 stars
B08QZTPL9Y,"December 18, 2020",No discount,$729.00,"2021 Newest Dell Inspiron 15 3000 Business Laptop, 15.6"" Full HD Touchscreen, AMD Ryzen 5 3450U, 16GB DDR4 RAM, 1TB SSD, Webcam, Wi-Fi, HDMI, Windows 10 Pro, Black",,2 ratings,"   #19,744 in Computers & Accessories ( See Top 100 in Computers & Accessories )      #3,077 in  Traditional Laptop Computers     ",2.7 out of 5 stars
B09WNCYHC4,"May 13, 2021",No discount,$399.99,"2021 HP 15.6"" Thin Laptop, AMD 3050U, 8GB RAM 128GB SSD Webcam, 1-Year Office365, Wi-Fi, Dual Core up to 2.8 GHz, Windows 10 S, FHD Display, Google Classroom Zoom School Business Ready, ROKC Bundle",,,"   #9,376 in Computers & Accessories ( See Top 100 in Computers & Accessories )      #1,236 in  Traditional Laptop Computers     ",
B096CMRD39,"June 1, 2021",No discount,$369.00,"2021 Newest HP Premium 14-inch HD Laptop, Intel Dual-Core Processor Up to 2.8GHz, 8GB RAM, 64GB eMMC Storage, Webcam, Bluetooth, HDMI, Wi-Fi, Blue, Windows 10 with 1 Year Microsoft 365",122 answered questions,"1,618 ratings","   #4,501 in Computers & Accessories ( See Top 100 in Computers & Accessories )      #513 in  Traditional Laptop Computers     ",4.3 out of 5 stars
B09NL8JTB6,"December 13, 2021",No discount,$639.00,"HP Pavilion 15.6"" FHD Laptop (2022 Latest Model), AMD Ryzen 5 5500U (Beats i7-11370H), 16GB RAM, 512GB PCIe NVMe M.2 SSD, Thin & Portable, Micro-Edge & Anti-Glare Screen, Long Battery Life, Windows 11",42 answered questions,462 ratings,"   #2,394 in Computers & Accessories ( See Top 100 in Computers & Accessories )      #240 in  Traditional Laptop Computers     ",4.4 out of 5 stars
B08W54YSPW,"February 7, 2021",,,"Lenovo IdeaPad 5 15.6"" FHD IPS Touchscreen Laptop | 11th Gen Intel Core i7-1165G7 | 12GB RAM | 512GB SSD | Backlit Keyboard | Fingerprint Reader | Windows 10",66 answered questions,215 ratings,"   #10,403 in Computers & Accessories ( See Top 100 in Computers & Accessories )      #1,426 in  Traditional Laptop Computers     ",4.3 out of 5 stars
B09BBHXYZ9,"July 27, 2021",No discount,$359.00,"HP Pavilion Laptop (2022 Model), 15.6"" HD Display, Intel Celeron Quad-Core Processor, 8GB DDR4 RAM, 128GB SSD, Online Conferencing, Webcam, HDMI, WiFi, Bluetooth, Windows 11",7 answered questions,103 ratings,   #543 in Computers & Accessories ( See Top 100 in Computers & Accessories )      #53 in  Traditional Laptop Computers     ,4.6 out of 5 stars
B092YHJGMN,"June 1, 2021",$764.26,$839.99,"Acer Nitro 5 AN515-55-53E5 Gaming Laptop | Intel Core i5-10300H | NVIDIA GeForce RTX 3050 Laptop GPU | 15.6"" FHD 144Hz IPS Display | 8GB DDR4 | 256GB NVMe SSD | Intel Wi-Fi 6 | Backlit Keyboard",896 answered questions,"7,507 ratings",   #139 in Computers & Accessories ( See Top 100 in Computers & Accessories )      #7 in  Traditional Laptop Computers     ,4.6 out of 5 stars
B09F8JJDLW,"October 5, 2021",,,"HP Stream 11 Laptop, Intel Celeron N4020, 4 GB RAM, 64 GB Storage, 11.6” HD Anti-Glare Display, Windows 11, Long Battery Life, Thin & Portable, Includes Microsoft 365 (11-ak0040nr, 2021 Diamond White)",29 answered questions,435 ratings,   #249 in Computers & Accessories ( See Top 100 in Computers & Accessories )      #20 in  Traditional Laptop Computers     ,4.4 out of 5 stars
B09R3BXQCG,"January 22, 2022",No discount,$549.00,"Newest Dell Inspiron 3510 15.6"" HD Laptop, Intel Pentium N5030 Processor, Webcam, WiFi, HDMI, Bluetooth, Windows 11 Home, Black (16GB RAM | 512GB PCIe SSD)",24 answered questions,329 ratings,"   #12,965 in Computers & Accessories ( See Top 100 in Computers & Accessories )      #1,904 in  Traditional Laptop Computers     ",4.3 out of 5 stars
B09NLX2SMP,"November 22, 2021",No discount,$599.00,"2022 Newest HP 17.3"" HD+ Display, 11th Gen Intel Core i3-1115G4(Up to 4.1GHz, Beat i5-1030G7), 16GB DDR4 RAM, 1TB HDD+256GB PCIe SSD, Bluetooth, HDMI, Webcam, Windows 11, Silver, w/ 3in1 Accessories",24 answered questions,63 ratings,"   #1,173 in Computers & Accessories ( See Top 100 in Computers & Accessories )      #111 in  Traditional Laptop Computers     ",4.5 out of 5 stars
B097NHS4P1,"June 17, 2021",No discount,"$1,392.99","MSI GE76 Raider Gaming Laptop 2021 (1TB SSD, 16GB RAM) 17.3"" FHD 144 Hz, Intel Core i7-1180H (11th Gen), NVIDIA GeForce RTX 3060, Windows 10 64bit (Titanium Blue) 11UE-046 US Model",19 answered questions,37 ratings,"   #4,230 in Computers & Accessories ( See Top 100 in Computers & Accessories )      #464 in  Traditional Laptop Computers     ",4.5 out of 5 stars
B09VRDJ4L8,"March 16, 2022",No discount,$399.99,"2022 HP Pavilion Laptop, 14-inch HD Touchscreen, AMD 3000 Series Processor, 8GB RAM, 192GB Storage, Long Battery Life, Webcam, HDMI, Windows 10 + One Year of Office365, Rose Gold (Latest Model)",9 answered questions,35 ratings,"   #1,904 in Computers & Accessories ( See Top 100 in Computers & Accessories )      #191 in  Traditional Laptop Computers     ",4.4 out of 5 stars
B0843JCV17,"January 21, 2020",No discount,$709.88,"MSI GF63 THIN 9SCX-005 15. 6"" FHD Gaming Laptop Intel Core i5-9300H GTX1650 8GB 256GB NVMe SSD Win10",115 answered questions,355 ratings,"   #22,449 in Computers & Accessories ( See Top 100 in Computers & Accessories )      #3,640 in  Traditional Laptop Computers     ",4.6 out of 5 stars
B09NRR6NTY,"June 1, 2021",No discount,$759.99,"2021 HP Newest Premium Laptop Computer, 17.3"" Full HD 1080P IPS Screen, 11th Gen Intel Core i5-1135G7(Beat i7-1065G7), 16GB RAM, 1TB SSD, HDMI, Wi-Fi, Webcam, Windows 11 | LIONEYE HDMI Cable",16 answered questions,58 ratings,"   #7,985 in Computers & Accessories ( See Top 100 in Computers & Accessories )      #999 in  Traditional Laptop Computers     ",4.4 out of 5 stars
B09WW3J4BB,"March 30, 2022",No discount,$739.00,"Lenovo IdeaPad Laptop (2022 Newest Model), 17.3"" HD+ Display, AMD Ryzen 5 5500U Processor (Beats i7-11375H), 20GB RAM, 1TB PCIe SSD, AMD Radeon 7 Graphics, Webcam, Fingerprint Reader, Windows 11",,1 rating,"   #3,339 in Computers & Accessories ( See Top 100 in Computers & Accessories )      #351 in  Traditional Laptop Computers     ",5.0 out of 5 stars
B09H8RCFYV,"September 27, 2021",No discount,$639.00,"HP Pavilion 15.6"" FHD Laptop, AMD Ryzen 5 5500U (Beats i7-11370H), 16GB RAM, 512GB PCIe NVMe M.2 SSD, Thin & Portable, Micro-Edge & Anti-Glare, Long Battery Life, Win10, Rose Gold (2021 Latest Model)",42 answered questions,462 ratings,"   #4,303 in Computers & Accessories ( See Top 100 in Computers & Accessories )      #477 in  Traditional Laptop Computers     ",4.4 out of 5 stars
B09GKZJ98J,"September 17, 2021",No discount,$399.00,"2021 Newest HP Premium 14 inch HD Laptop, Intel Dual-Core Processor Up to 2.6GHz, 16GB RAM, 64GB eMMC Storage, Webcam, Bluetooth, HDMI, Wi-Fi, Blue, Windows 11 with 1 Year Microsoft 365",122 answered questions,"1,618 ratings","   #14,708 in Computers & Accessories ( See Top 100 in Computers & Accessories )      #2,196 in  Traditional Laptop Computers     ",4.3 out of 5 stars
B09LHFLTWT,"November 10, 2021",No discount,$599.00,"2022 HP 17.3 Laptop, FHD IPS Display, 11th Gen Intel Core i51135G7Beats i78500, 8GB DDR4 RAM, 512GB SSD, Wi 17 30.99 inches 568B7UA 0",,,"   #44,584 in Computers & Accessories ( See Top 100 in Computers & Accessories )      #7,946 in  Traditional Laptop Computers     ",
B08YKDYWK5,"March 10, 2021",$529.00,$609.99,"Lenovo IdeaPad 3 14 Laptop, AMD Ryzen 5 5500U, 8GB RAM, 256GB Storage, 14.0"" FHD Display, AMD Radeon 7 Graphics, Windows 10 Home, Abyss Blue",115 answered questions,452 ratings,"   #2,224 in Computers & Accessories ( See Top 100 in Computers & Accessories )      #221 in  Traditional Laptop Computers     ",4.5 out of 5 stars
B09J1RKG24,"September 16, 2021",No discount,$779.49,"Lenovo IdeaPad 3 15ITL06 82H801E0US 15.6"" Touchscreen Notebook - Full HD - 1920 x 1080 - Intel Core i5 i5-1135G7 Quad-core (4 Core) 2.40 GHz - 8 GB RAM - 256 GB SSD - Abyss Blue",,,"   #75,793 in Computers & Accessories ( See Top 100 in Computers & Accessories )      #14,924 in  Traditional Laptop Computers     ",
B09P3LSLZC,"December 23, 2021",No discount,$329.90,"Windows 11 Laptop,HTOOLS Laptop Computer,Intel Celeron N4120 Quad-Core 8 GB Ram,128GB SSD(2TB SSD Expansion),Computer Laptop Clearance,FHD IPS&2MP Webcam,Dual WiFi,Type C,Computadoras Laptop",21 answered questions,67 ratings,"   #3,500 in Computers & Accessories ( See Top 100 in Computers & Accessories )      #372 in  Traditional Laptop Computers     ",4.0 out of 5 stars
B09MLPK4XX,"November 25, 2021",No discount,$659.00,"Newest 2022 HP 15.6"" FHD Micro-Edge Laptop, AMD Ryzen 5 5500U 6-core(Beat i7-1160G7, up to 4GHz), 16GB RAM, 512GB PCIe SSD, AMD Radeon Graphics, WiFi, HDMI, Fast Charge, Windows 11, w/3in1 Accessories",31 answered questions,115 ratings,   #822 in Computers & Accessories ( See Top 100 in Computers & Accessories )      #76 in  Traditional Laptop Computers     ,4.3 out of 5 stars
B09MTLFVYL,"November 30, 2021",No discount,$669.00,"2022 Newest HP 17.3"" HD+ Display, 11th Gen Intel Core i3-1115G4(Up to 4.1GHz, Beat i5-1030G7), 16GB DDR4 RAM, 1TB PCIe SSD, Bluetooth, HDMI, Webcam, Windows 11, Silver, w/ 3in1 Accessories",24 answered questions,63 ratings,"   #13,066 in Computers & Accessories ( See Top 100 in Computers & Accessories )      #1,926 in  Traditional Laptop Computers     ",4.5 out of 5 stars
