ASIN,Date_first_available,Discounted_price,Listing_price,Name,Number_of_answered_questions,Number_of_reviews,Product_Rank,Rating
B09N7VGZNW,"December 7, 2021",No discount,$599.00,"HP Pavilion Laptop (2022 Model), 15.6"" HD Touchscreen, AMD Ryzen 3 3250U Processor (Beats i7-7500U), 16GB RAM, 512GB SSD, Backlit Keyboard, Compact Design, Long Battery Life, Windows 10",4 answered questions,36 ratings,"   #1,783 in Computers & Accessories ( See Top 100 in Computers & Accessories )      #180 in  Traditional Laptop Computers     ",4.1 out of 5 stars
B09JGSWN1W,"January 23, 2022",$699.99,$749.99,"Acer Aspire 5 A517-52-58UL Laptop | 17.3"" Full HD IPS Display | 11th Gen Intel Core i5-1135G7 | Intel Iris Xe Graphics | 8GB DDR4 | 512GB SSD | WiFi 6 | Fingerprint Reader | BL Keyboard | Windows 11",,,"   #23,738 in Computers & Accessories ( See Top 100 in Computers & Accessories )      #3,911 in  Traditional Laptop Computers     ",
B096CQYB8L,"June 1, 2021",No discount,$399.00,"2021 Newest HP Premium 14-inch HD Laptop, Intel Dual-Core Processor Up to 2.8GHz, 16GB RAM, 64GB eMMC Storage, Webcam, Bluetooth, HDMI, Wi-Fi, Black, Windows 10 with 1 Year Microsoft 365",122 answered questions,"1,618 ratings","   #5,206 in Computers & Accessories ( See Top 100 in Computers & Accessories )      #597 in  Traditional Laptop Computers     ",4.3 out of 5 stars
B09PMJX2HP,"January 3, 2022",No discount,$758.00,"2021 Newest Dell Inspiron 3000 Premium Laptop, 15.6 FHD Display, Intel Core i5-1135G7, Online Meeting Ready, Webcam, WiFi, HDMI, Windows 10 Home (16GB DDR4 RAM | 1TB PCIe SSD)",16 answered questions,63 ratings,"   #14,217 in Computers & Accessories ( See Top 100 in Computers & Accessories )      #2,127 in  Traditional Laptop Computers     ",4.4 out of 5 stars
B09WHH2Z5D,"March 24, 2022",No discount,$189.00,"2022 Flagship Acer 311 Chromebook 11.6"" HD Display Laptop Student Business, MediaTek MT8183C 8-Core Processor, 4GB RAM, 32GB eMMC, Wi-Fi 5, Webcam, Upto 15 Hours Battery, Chrome OS+HubxcelAccessories",,1 rating,"   #7,754 in Computers & Accessories ( See Top 100 in Computers & Accessories )      #961 in  Traditional Laptop Computers     ",1.0 out of 5 stars
B09P8H3VB1,"December 27, 2021",,,"Jumper Laptop 14 Inch Full HD 1080P IPS Display, 12GB DDR4 256GB SSD, Windows 10 Slim Laptop Computer,Celeron CPU,HD Webcam, Mini HDMI, USB3.0, 2.4/5G WiFi,Long Battery Life,Thin & Portable-Gray",12 answered questions,21 ratings,"   #4,302 in Computers & Accessories ( See Top 100 in Computers & Accessories )      #476 in  Traditional Laptop Computers     ",4.5 out of 5 stars
B09KYK3Y35,"November 3, 2021",No discount,$949.99,"2022 HP Pavilion 17 Laptop, 17.3"" HD+ IPS Touchscreen, 11th Gen Intel Core i5-1135G7, GeForce MX350, 16 GB RAM, 1 TB PCIe SSD, WiFi, Webcam, DVD-RW, Backlit Keyboard, Windows 11, Silver",5 answered questions,8 ratings,"   #16,678 in Computers & Accessories ( See Top 100 in Computers & Accessories )      #2,515 in  Traditional Laptop Computers     ",3.5 out of 5 stars
B0929DQRJR,"April 12, 2021",No discount,$449.00,"HP Pavilion Laptop (2021 Latest Model), AMD Athlon 3050U Processor, 8GB RAM, 256GB SSD, Long Battery Life, Webcam, HDMI, Bluetooth, WiFi, Silver, Win 10 + Oydisen Cloth",23 answered questions,240 ratings,"   #52,219 in Computers & Accessories ( See Top 100 in Computers & Accessories )      #9,532 in  Traditional Laptop Computers     ",4.5 out of 5 stars
B09PF4XXS5,"December 29, 2021",No discount,$579.00,"HP Pavilion Laptop (2022 Model), 14"" FHD IPS NonTouch Display, AMD Ryzen 3 3250U, 16GB RAM, 512GB SSD + 1TB HDD, Micro-Edge, Thin & Portable, Micro-Edge & Anti-Glare Screen, Long Battery Life, Win 11",,12 ratings,"   #22,539 in Computers & Accessories ( See Top 100 in Computers & Accessories )      #3,660 in  Traditional Laptop Computers     ",4.1 out of 5 stars
B08C783Z2P,"July 2, 2020",No discount,$699.00,"2021 Newest Acer Aspire 5 15.6"" FHD 1080P Laptop Computer AMD Ryzen 3 3200U (Beat i5-7200u) 16GB RAM 512GB SSD+1TB HDD Backlit KB Fingerprint WiFi6 Bluetooth HDMI Windows 10 with E.S32GB USB Card",21 answered questions,87 ratings,"   #18,088 in Computers & Accessories ( See Top 100 in Computers & Accessories )      #2,772 in  Traditional Laptop Computers     ",4.4 out of 5 stars
B09SBR6WBW,"January 1, 2021",No discount,$134.00,"Evolve III Maestro E-Book Laptop (64GB, 4GB RAM, Wi-Fi+ 4G LTE) 11.6"" Intel Celeron N3450 GSM Unlocked Windows 10 Cellular Notebook (128GB SD Bundle, Gray)",,6 ratings,"   #3,474 in Computers & Accessories ( See Top 100 in Computers & Accessories )      #370 in  Traditional Laptop Computers     ",4.0 out of 5 stars
B08HSNRFTX,"September 10, 2020",No discount,$344.00,Dell Inspiron 3583 15” Laptop Intel Celeron – 128GB SSD – 4GB DDR4 – 1.6GHz - Intel UHD Graphics 610 - Windows 10 Home - Inspiron 15 3000 Series - New,129 answered questions,930 ratings,"   #1,153 in Computers & Accessories ( See Top 100 in Computers & Accessories )      #108 in  Traditional Laptop Computers     ",4.4 out of 5 stars
B09KMHZRM3,"October 28, 2021",No discount,"$1,199.99","2021 MSI GF65 Gaming Laptop, 15.6"" FHD 144Hz IPS Display, Intel Six-Core i5-10500H Processor, NVIDIA GeForce RTX 3060 GDDR6, 16GB RAM, 1TB PCIe NVMe SSD, WiFi 6, Backlit KB, HDMI, Windows 10, Black",3 answered questions,37 ratings,"   #12,639 in Computers & Accessories ( See Top 100 in Computers & Accessories )      #1,850 in  Traditional Laptop Computers     ",4.5 out of 5 stars
B09VZ6JB6X,"March 19, 2022",No discount,$529.99,"HP 15.6 Laptop FHD 1080P IPS Display 2022 Newest, 11th Gen Intel Core i3-1115G4 (Beat i5-1035G4), 16GB DDR4 RAM, 512GB SSD, HDMI, WiFi, Lightweight, Fingerprint, Windows 10, Silver + CUE Accessories",,,"   #27,060 in Computers & Accessories ( See Top 100 in Computers & Accessories )      #4,541 in  Traditional Laptop Computers     ",
B09SKTVNS1,"February 16, 2022",No discount,"$1,499.00","GIGABYTE A5 X1 - 15.6"" FHD IPS Anti-Glare 240Hz - AMD Ryzen™ 9 5900HX - NVIDIA GeForce RTX 3070 Laptop GPU 8 GB GDDR6 - 16 GB Memory - 512 GB PCIe SSD - Win 11 Home - Gaming Laptop (A5 X1-CUS2130SB)",18 answered questions,17 ratings,"   #14,498 in Computers & Accessories ( See Top 100 in Computers & Accessories )      #2,173 in  Traditional Laptop Computers     ",4.3 out of 5 stars
B098QN61YK,"July 6, 2021",No discount,$459.99,"DERE Laptop with Fingerprint Unlock 15.6"" Laptop Computer with Full-Size Backlit Keyboard Intel Celeron N5095 Processor 12GB DDR4+256GB SSD, 1920x1080 FHD Windows 10, 5G WiFi, USB 3.0 MBook M11 Red",19 answered questions,14 ratings,"   #46,154 in Computers & Accessories ( See Top 100 in Computers & Accessories )      #8,261 in  Traditional Laptop Computers     ",4.0 out of 5 stars
B08P6MRZBG,"November 27, 2020",No discount,$749.00,"HP - Pavilion 15.6"" Gaming Laptop - AMD Ryzen 5 - 8GB Memory - NVIDIA GeForce GTX 1650 - 256GB SSD - Shadow Black",128 answered questions,660 ratings,"   #6,629 in Computers & Accessories ( See Top 100 in Computers & Accessories )      #793 in  Traditional Laptop Computers     ",4.6 out of 5 stars
B09NDHKP8R,"December 10, 2021",No discount,$169.99,"5G WiFi Mini Projector, BloBlo CP801 Video Projector with Native 1080P, 9500L Brightness, Built-in 5W Stereo Speaker, 4K Supported for Home Theater, Compatible with iOS/Android Phone/Laptop/TV Stick",49 answered questions,43 ratings,   #306 in  Video Projectors     ,4.6 out of 5 stars
B09S6TZFLN,"November 15, 2021",No discount,$768.99,"[Windows 11+Backlit Keyboard] 2022 HP 17 Full HD Laptop, Intel 4-Core i5-1135G7(Beat i7-8550U), 16GB DDR4, 1TB SSD, 17.3 IPS Screen, Webcam with Mic, Wi-Fi, HDMI, RJ-45, Thin Design, ROKC MP Bundle",4 answered questions,18 ratings,"   #97,385 in Computers & Accessories ( See Top 100 in Computers & Accessories )      #20,063 in  Traditional Laptop Computers     ",4.9 out of 5 stars
B087GXY9SV,"April 22, 2020",No discount,$341.88,"HP ProBook 640 G2 14 Inch Business Laptop, Intel Core i7-6600U up to 3.4GHz, 16G DDR4, 512G SSD, Webcam, USB 3.0, Type-C, WiFi, VGA, DP, Win 10 Pro 64 Bit (Renewed)",21 answered questions,34 ratings,"   #2,749 in Computers & Accessories ( See Top 100 in Computers & Accessories )      #276 in  Traditional Laptop Computers     ",3.6 out of 5 stars
B094CDXC1M,"May 7, 2021",,,"2021 Newest Dell Inspiron 3000 Laptop, 15.6 HD Display, Intel Core i5-1035G1, 16GB DDR4 RAM, 512GB PCIe SSD, Online Meeting Ready, Webcam, WiFi, HDMI, Win10 Home, Black",21 answered questions,97 ratings,"   #16,192 in Computers & Accessories ( See Top 100 in Computers & Accessories )      #2,438 in  Traditional Laptop Computers     ",4.4 out of 5 stars
B09D21T7R8,"August 18, 2021",No discount,$329.99,"2022 ASUS L510 Ultra Thin Laptop, 15.6"" FHD Display, Intel Celeron N4020 Processor, 4GB RAM, 256 GB Storage, 8Hrs+ Battery Life, Backlit Keyboard, Windows 10 Home + 1 Year Microsoft 365, Star Black",15 answered questions,108 ratings,"   #4,661 in Computers & Accessories ( See Top 100 in Computers & Accessories )      #537 in  Traditional Laptop Computers     ",4.5 out of 5 stars
B09P3MXCHT,"December 23, 2021",,$429.99,"Jumper Laptop 13.3 Inch Full HD 1080p IPS Display, 8GB RAM 256GB SSD, Windows 10 Slim Laptops Computer,Quad Core Celeron CPU,HD Webcam, Mini HDMI, USB3.0,Bluetooth 4.2, Dual-Band 5G WiFi, Gray",24 answered questions,157 ratings,   #992 in Computers & Accessories ( See Top 100 in Computers & Accessories )      #89 in  Traditional Laptop Computers     ,4.4 out of 5 stars
B09T3DM9TZ,"February 15, 2022",No discount,$469.99,"Daysky Windows Laptops V14S, Intel Jasper Lake N5095 Processor, 14.1"" FHD Display, Backlit Keyboard, Full Metal Body, Ultra Thin and Portable, USB 3.0, Type C (12GB+256GB, Pink)",5 answered questions,23 ratings,"   #86,694 in Office Products ( See Top 100 in Office Products )      #651 in  Laptop Stands      #1,568 in  Office Carts & Stands     ",4.1 out of 5 stars
B09RQ5VL7S,"February 2, 2022",$349.00,$499.00,"2022 Flagship Acer Chromebook 15.6"" FHD 1080p IPS Touchscreen Light Laptop, Intel Celeron N4020 (Up to 2.8GHz), 4GB RAM, 64GB eMMC,HD Webcam,Gigabit WiFi, 12+ Hours Battery,Chrome OS,w/HubxcelCables",5 answered questions,23 ratings,"   #10,401 in Computers & Accessories ( See Top 100 in Computers & Accessories )      #1,424 in  Traditional Laptop Computers     ",4.0 out of 5 stars
B09T27FB3V,"February 21, 2022",No discount,$549.00,"2022 Newest HP Notebook 15 Laptop, 15.6"" HD Screen, Intel Celeron N4020 Processor, 16GB DDR4 Memory, 1TB SSD Storage, Webcam, USB Type-C, RJ-45, HDMI, Windows 11 Home, Silver",,14 ratings,"   #9,872 in Computers & Accessories ( See Top 100 in Computers & Accessories )      #1,330 in  Traditional Laptop Computers     ",4.9 out of 5 stars
B08XWLTKD1,"March 2, 2021",No discount,$349.00,"2021 Dell Inspiron 15 3000 15.6"" HD Laptop Computer, Intel Celeron Processor 4205U, 4GB RAM, 128GB PCIe SSD, Intel UHD Graphics 610, Waves MaxxAudio, HD Webcam, Windows 10, Black",10 answered questions,41 ratings,"   #2,927 in Computers & Accessories ( See Top 100 in Computers & Accessories )      #297 in  Traditional Laptop Computers     ",4.3 out of 5 stars
B09P6CVYLB,"December 25, 2021",No discount,$539.99,"Lenovo IdeaPad 3 15"" HD Touch Screen Laptop, Intel Core i3-1115G4(up to 4.1GHz), 20GB RAM 512GB PCIe SSD, Webcam, Bluetooth, Grey Windows 11 H",,3 ratings,"   #3,277 in Computers & Accessories ( See Top 100 in Computers & Accessories )      #346 in  Traditional Laptop Computers     ",5.0 out of 5 stars
B099P4TWYY,"July 16, 2021",No discount,$399.00,"2021 Acer Aspire Thin and Light Laptop, 15.6"" FHD Display, Intel Celeron Dual-Core N4500 Processor, 8GB RAM, 256GB SSD, Webcam, WiFi, HDMI, Bluetooth, Windows 10, Pure Silver + One Year Office365",13 answered questions,68 ratings,"   #6,117 in Computers & Accessories ( See Top 100 in Computers & Accessories )      #718 in  Traditional Laptop Computers     ",4.5 out of 5 stars
B09NCYMGRZ,"December 10, 2021",No discount,$235.00,"Lenovo 14w Laptop Gen 2, 14"" HD (1366X768) Notebook, AMD 3015e Processor up to 1.20 GHz, 4 GB DDR4 RAM, 64GB eMMC, Bluetooth, WiFi, Black, Windows 10 Pro, EAT 64GB SD Card",,8 ratings,"   #18,071 in Computers & Accessories ( See Top 100 in Computers & Accessories )      #2,768 in  Traditional Laptop Computers     ",4.5 out of 5 stars
B07GXXM9XR,"February 19, 2018",No discount,$549.99,"Dell Precision 7510 FHD 15.6 Inch Workstation Business Laptop (Intel Quad Core i7-6820HQ, 32GB Ram, 512GB SSD, HDMI, USB 3.0, Numeric K.B) Nvidia Quadro M1000M 4GB DDR5 (Renewed)",7 answered questions,1 rating,"   #33,821 in Computers & Accessories ( See Top 100 in Computers & Accessories )      #5,867 in  Traditional Laptop Computers     ",2.0 out of 5 stars
B08PW3JQ75,"December 7, 2020",No discount,"$1,098.99","2022 Newest HP Pavilion Laptop, 15.6"" Full HD Touchscreen, Intel Core i7-1195G7 Quad-Core Processor, 16GB RAM, 1TB PCIe NVMe SSD, Backlit Keyboard, Webcam, HDMI, Wi-Fi 6, Bluetooth, Windows 11 Home",13 answered questions,53 ratings,"   #59,543 in Computers & Accessories ( See Top 100 in Computers & Accessories )      #11,167 in  Traditional Laptop Computers     ",4.1 out of 5 stars
B08GZPDSF5,"October 1, 2020",,,"Microsoft Surface Laptop Go - 12.4"" Touchscreen - Intel Core i5 - 8GB Memory - 128GB SSD - Sandstone",110 answered questions,"1,132 ratings","   #22,139 in Computers & Accessories ( See Top 100 in Computers & Accessories )      #3,570 in  Traditional Laptop Computers     ",4.6 out of 5 stars
B085B3GFRL,"April 2, 2020",No discount,"$1,949.86","MSI GL65 Leopard 10SFK-062 15.6"" FHD 144Hz 3ms Thin Bezel Gaming Laptop Intel Core i7-10750H RTX2070 16GB 512GB NVMe SSD Win 10",328 answered questions,"2,088 ratings","   #13,736 in Computers & Accessories ( See Top 100 in Computers & Accessories )      #2,047 in  Traditional Laptop Computers     ",4.7 out of 5 stars
B07GCRW5BM,"August 11, 2018",No discount,$327.00,"Dell Latitude E5570 15.6in Laptop, Core i5-6300U 2.4GHz, 8GB Ram, 256GB SSD, Windows 10 Pro 64bit (Renewed)",32 answered questions,98 ratings,"   #5,504 in Computers & Accessories ( See Top 100 in Computers & Accessories )      #638 in  Traditional Laptop Computers     ",4.1 out of 5 stars
B09S6TZFLN,"November 15, 2021",No discount,$768.99,"[Windows 11+Backlit Keyboard] 2022 HP 17 Full HD Laptop, Intel 4-Core i5-1135G7(Beat i7-8550U), 16GB DDR4, 1TB SSD, 17.3 IPS Screen, Webcam with Mic, Wi-Fi, HDMI, RJ-45, Thin Design, ROKC MP Bundle",4 answered questions,18 ratings,"   #97,385 in Computers & Accessories ( See Top 100 in Computers & Accessories )      #20,063 in  Traditional Laptop Computers     ",4.9 out of 5 stars
B09QTQ65HD,"January 20, 2022",No discount,$689.00,"2022 HP Pavilion 17.3-inch IPS FHD Laptop, Intel Quad Core i5-1135G7 (Beats i7-1065G7,upto 4.2GHz), Iris Xe Graphics, 16GB RAM, 512GB PCIe SSD,Backlit Keyboard, WiFi 5,Webcam, Windows 11+HubxcelCables",15 answered questions,19 ratings,"   #2,861 in Computers & Accessories ( See Top 100 in Computers & Accessories )      #288 in  Traditional Laptop Computers     ",4.5 out of 5 stars
B09C4RDFNS,"August 8, 2021",,,"VIDOKA Native 1080P Projector with WiFi and Bluetooth, 8000L Full HD Projector for Home Outdoor Movie, Support Video Zoom and Sleep Timer, Compatible w/ TV Stick/iPhone/iPad/Laptop/PC/Smartphone",36 answered questions,94 ratings,   #199 in  Video Projectors     ,4.2 out of 5 stars
B087GXY9SV,"April 22, 2020",No discount,$341.88,"HP ProBook 640 G2 14 Inch Business Laptop, Intel Core i7-6600U up to 3.4GHz, 16G DDR4, 512G SSD, Webcam, USB 3.0, Type-C, WiFi, VGA, DP, Win 10 Pro 64 Bit (Renewed)",21 answered questions,34 ratings,"   #2,749 in Computers & Accessories ( See Top 100 in Computers & Accessories )      #276 in  Traditional Laptop Computers     ",3.6 out of 5 stars
B08HCMJ84M,"August 28, 2020",No discount,$299.00,"15.6 inch Laptop, IPS Display, 64-bit Quad-core celeron_j3455 Processor, 8GB RAM, 256GB SSD, scalable 1TB SSD Solid State Drive, Chocolate Keyboard, Windows 10",11 answered questions,79 ratings,"   #14,723 in Computers & Accessories ( See Top 100 in Computers & Accessories )      #2,199 in  Traditional Laptop Computers     ",3.8 out of 5 stars
B09P3MXCHT,"December 23, 2021",,$429.99,"Jumper Laptop 13.3 Inch Full HD 1080p IPS Display, 8GB RAM 256GB SSD, Windows 10 Slim Laptops Computer,Quad Core Celeron CPU,HD Webcam, Mini HDMI, USB3.0,Bluetooth 4.2, Dual-Band 5G WiFi, Gray",24 answered questions,157 ratings,   #992 in Computers & Accessories ( See Top 100 in Computers & Accessories )      #89 in  Traditional Laptop Computers     ,4.4 out of 5 stars
B09J5133CG,"October 11, 2021",No discount,$569.99,"DaySky Windows 10 Laptops, 15.6 Inches FHD, Intel Celeron N5095 Quad-Core 10nm Processor, Full Size Keyboard, 5mm Narrow Bezel, WiFi, USB 3.0, Type C Computer (12GB+512GB, Black)",3 answered questions,27 ratings,"   #100,691 in Computers & Accessories ( See Top 100 in Computers & Accessories )      #20,875 in  Traditional Laptop Computers     ",3.8 out of 5 stars
B094CDXC1M,"May 7, 2021",,,"2021 Newest Dell Inspiron 3000 Laptop, 15.6 HD Display, Intel Core i5-1035G1, 16GB DDR4 RAM, 512GB PCIe SSD, Online Meeting Ready, Webcam, WiFi, HDMI, Win10 Home, Black",21 answered questions,97 ratings,"   #16,192 in Computers & Accessories ( See Top 100 in Computers & Accessories )      #2,438 in  Traditional Laptop Computers     ",4.4 out of 5 stars
B09237FD1R,"April 8, 2021",No discount,$569.00,"2021 Dell Inspiron 15 3505 15.6"" FHD Laptop Computer, AMD Ryzen 5-3450U Processor, 8GB RAM, 512GB PCIe SSD, AMD Radeon Vega 8 Graphics, Webcam, HDMI, Bluetooth, Windows 10, White",,5 ratings,"   #69,040 in Computers & Accessories ( See Top 100 in Computers & Accessories )      #13,348 in  Traditional Laptop Computers     ",4.5 out of 5 stars
B089CLKMG7,"May 28, 2020",No discount,"$1,109.99","2020 Lenovo ThinkPad E15 15.6” FHD Business Laptop Computer, 10th gen Intel i5-10210U (up to 4.20GHz), 32GB RAM, 1TB SSD, WiFi HDMI Win10 Pro",48 answered questions,235 ratings,"   #6,223 in Computers & Accessories ( See Top 100 in Computers & Accessories )      #741 in  Traditional Laptop Computers     ",4.4 out of 5 stars
B09KYJSTH2,"November 3, 2021",No discount,$549.00,"2022 Newest HP Premium Laptop, 15.6"" HD LED Display, AMD Dual-Core Processor, AMD Radeon Graphics, 16GB RAM, 1TB SSD, 3 in 1 Business Bundle, HDMI, USB Type-C, Long Battery Life, Windows 10, Silver",4 answered questions,49 ratings,"   #15,665 in Computers & Accessories ( See Top 100 in Computers & Accessories )      #2,346 in  Traditional Laptop Computers     ",4.4 out of 5 stars
B08PW3JQ75,"December 7, 2020",No discount,"$1,098.99","2022 Newest HP Pavilion Laptop, 15.6"" Full HD Touchscreen, Intel Core i7-1195G7 Quad-Core Processor, 16GB RAM, 1TB PCIe NVMe SSD, Backlit Keyboard, Webcam, HDMI, Wi-Fi 6, Bluetooth, Windows 11 Home",13 answered questions,53 ratings,"   #59,543 in Computers & Accessories ( See Top 100 in Computers & Accessories )      #11,167 in  Traditional Laptop Computers     ",4.1 out of 5 stars
B08GZPDSF5,"October 1, 2020",,,"Microsoft Surface Laptop Go - 12.4"" Touchscreen - Intel Core i5 - 8GB Memory - 128GB SSD - Sandstone",110 answered questions,"1,132 ratings","   #22,139 in Computers & Accessories ( See Top 100 in Computers & Accessories )      #3,570 in  Traditional Laptop Computers     ",4.6 out of 5 stars
B09H2WHFB8,"September 24, 2021",$269.99,$328.99,"Azeyou 14 inch U40 Laptop, up to 2.8GHz Celeron Processor, 6GB RAM + 128GB ROM, HD IPS Display, Number touchpad, Windows 10,Thin & Portable, 2MP Webcam, WiFi Notebook Computer",7 answered questions,15 ratings,"   #25,511 in Computers & Accessories ( See Top 100 in Computers & Accessories )      #4,253 in  Traditional Laptop Computers     ",3.6 out of 5 stars
B093BDM3PC,"April 22, 2021",No discount,$289.00,"2021 Newest HP 14 inch HD Laptop Computer, Intel Celeron N4000 up to 2.6 GHz, 4GB DDR4, 64GB eMMC Storage, WiFi , Webcam, HDMI, Bluetooth, 1 Year Microsoft 365,Windows 10 S, Blue + Hubxcel Cables",12 answered questions,178 ratings,"   #10,501 in Computers & Accessories ( See Top 100 in Computers & Accessories )      #1,452 in  Traditional Laptop Computers     ",4.3 out of 5 stars
B085B3GFRL,"April 2, 2020",No discount,"$1,949.86","MSI GL65 Leopard 10SFK-062 15.6"" FHD 144Hz 3ms Thin Bezel Gaming Laptop Intel Core i7-10750H RTX2070 16GB 512GB NVMe SSD Win 10",328 answered questions,"2,088 ratings","   #13,736 in Computers & Accessories ( See Top 100 in Computers & Accessories )      #2,047 in  Traditional Laptop Computers     ",4.7 out of 5 stars
B07GCRW5BM,"August 11, 2018",No discount,$327.00,"Dell Latitude E5570 15.6in Laptop, Core i5-6300U 2.4GHz, 8GB Ram, 256GB SSD, Windows 10 Pro 64bit (Renewed)",32 answered questions,98 ratings,"   #5,504 in Computers & Accessories ( See Top 100 in Computers & Accessories )      #638 in  Traditional Laptop Computers     ",4.1 out of 5 stars
B09S6TZFLN,"November 15, 2021",No discount,$768.99,"[Windows 11+Backlit Keyboard] 2022 HP 17 Full HD Laptop, Intel 4-Core i5-1135G7(Beat i7-8550U), 16GB DDR4, 1TB SSD, 17.3 IPS Screen, Webcam with Mic, Wi-Fi, HDMI, RJ-45, Thin Design, ROKC MP Bundle",4 answered questions,18 ratings,"   #97,385 in Computers & Accessories ( See Top 100 in Computers & Accessories )      #20,063 in  Traditional Laptop Computers     ",4.9 out of 5 stars
B087GXY9SV,"April 22, 2020",No discount,$341.88,"HP ProBook 640 G2 14 Inch Business Laptop, Intel Core i7-6600U up to 3.4GHz, 16G DDR4, 512G SSD, Webcam, USB 3.0, Type-C, WiFi, VGA, DP, Win 10 Pro 64 Bit (Renewed)",21 answered questions,34 ratings,"   #2,749 in Computers & Accessories ( See Top 100 in Computers & Accessories )      #276 in  Traditional Laptop Computers     ",3.6 out of 5 stars
B094CDXC1M,"May 7, 2021",,,"2021 Newest Dell Inspiron 3000 Laptop, 15.6 HD Display, Intel Core i5-1035G1, 16GB DDR4 RAM, 512GB PCIe SSD, Online Meeting Ready, Webcam, WiFi, HDMI, Win10 Home, Black",21 answered questions,97 ratings,"   #16,192 in Computers & Accessories ( See Top 100 in Computers & Accessories )      #2,438 in  Traditional Laptop Computers     ",4.4 out of 5 stars
B09RDQGTT8,"January 28, 2022",No discount,$188.86,"2022 Newest Acer 311 Chromebook Laptop Student Business, MediaTek MT8183C 8-Core Processor,11.6"" HD Display, 4GB RAM, 32GB eMMC, Wi-Fi 5, Bluetooth 5, Upto 15 Hours Battery, Chrome OS +MarxsolCables",6 answered questions,23 ratings,"   #2,111 in Computers & Accessories ( See Top 100 in Computers & Accessories )      #210 in  Traditional Laptop Computers     ",4.4 out of 5 stars
B08R9FMKHY,"December 24, 2020",No discount,$999.00,"2021 Newest HP 15.6"" FHD IPS Touchscreen Laptop, 11th Gen Intel i7-1165G7(Up to 4.7GHz), 32GB RAM, 1TB PCIe SSD, Intel Iris Xe Graphics, Webcam, NumPad, USB-A&C, HDMI, WiFi, Bluetooth, Windows 11",4 answered questions,34 ratings,"   #9,478 in Computers & Accessories ( See Top 100 in Computers & Accessories )      #1,259 in  Traditional Laptop Computers     ",4.0 out of 5 stars
B08HXDFCHY,"September 12, 2020",No discount,$159.00,"HP 14-CA005CL 14"" FHD IPS WLED (1920 x 1080), Intel Celeron N3350 1.1GHz, 4 GB SDRAM, 64 GB eMMC, Chrome OS - White",,3 ratings,"   #86,784 in Computers & Accessories ( See Top 100 in Computers & Accessories )      #17,468 in  Traditional Laptop Computers     ",1.6 out of 5 stars
B07TYF55R2,"July 8, 2019",$200.00,$213.19,"Lenovo Thinkpad Yoga 11e Laptop 11.6inch Touchscreen Convertible Ultrabook PC, Intel Quad Core Processor, 128GB Solid State Drive, 4GB DDR3 RAM, HD Webcam, LED, HDMI, Bluetooth, Windows 10 (Renewed)",91 answered questions,746 ratings,"   #3,150 in Computers & Accessories ( See Top 100 in Computers & Accessories )      #327 in  Traditional Laptop Computers     ",4.1 out of 5 stars
B094F9NRFP,"May 8, 2021",No discount,$289.90,"BOCCONI LeadBook T6 Laptop | 15.6"" Full HD 1920x1080 IPS Display | Intel Celeron N3450 Quad-Core | 6GB DDR3 | 128GB SSD | AC WiFi | Mini HDMI | Windows 10 Home",12 answered questions,12 ratings,"   #75,380 in Computers & Accessories ( See Top 100 in Computers & Accessories )      #14,827 in  Traditional Laptop Computers     ",4.0 out of 5 stars
B07Q11TCP9,"March 23, 2019",$229.00,$299.00,"Lenovo 14"" FHD Laptop - AMD A6-9220C Dual-Core Processor, 4GB RAM, 64GB eMMC, Windows 10 Pro, Black - 14W (81MQ000JUS)",14 answered questions,73 ratings,"   #8,364 in Computers & Accessories ( See Top 100 in Computers & Accessories )      #1,067 in  Traditional Laptop Computers     ",3.7 out of 5 stars
B09P3MXCHT,"December 23, 2021",,$429.99,"Jumper Laptop 13.3 Inch Full HD 1080p IPS Display, 8GB RAM 256GB SSD, Windows 10 Slim Laptops Computer,Quad Core Celeron CPU,HD Webcam, Mini HDMI, USB3.0,Bluetooth 4.2, Dual-Band 5G WiFi, Gray",24 answered questions,157 ratings,   #992 in Computers & Accessories ( See Top 100 in Computers & Accessories )      #89 in  Traditional Laptop Computers     ,4.4 out of 5 stars
B09D21T7R8,"August 18, 2021",No discount,$329.99,"2022 ASUS L510 Ultra Thin Laptop, 15.6"" FHD Display, Intel Celeron N4020 Processor, 4GB RAM, 256 GB Storage, 8Hrs+ Battery Life, Backlit Keyboard, Windows 10 Home + 1 Year Microsoft 365, Star Black",15 answered questions,108 ratings,"   #4,661 in Computers & Accessories ( See Top 100 in Computers & Accessories )      #537 in  Traditional Laptop Computers     ",4.5 out of 5 stars
B08XWLTKD1,"March 2, 2021",No discount,$349.00,"2021 Dell Inspiron 15 3000 15.6"" HD Laptop Computer, Intel Celeron Processor 4205U, 4GB RAM, 128GB PCIe SSD, Intel UHD Graphics 610, Waves MaxxAudio, HD Webcam, Windows 10, Black",10 answered questions,41 ratings,"   #2,927 in Computers & Accessories ( See Top 100 in Computers & Accessories )      #297 in  Traditional Laptop Computers     ",4.3 out of 5 stars
